<?xml version="1.0" encoding="UTF-8"?>
<!-- Ejemplo de CrearVentaDTO validado contra venta.xsd -->
<crearVenta xmlns:xsi="http://www.w3.org/2001/XMLSchema-instance"
            xsi:noNamespaceSchemaLocation="venta.xsd">

  <idUsuario>1</idUsuario>
  <metodoPago>efectivo</metodoPago>
  <porcentajeImpuesto>16</porcentajeImpuesto>

  <productos>
    <producto>
      <idProducto>42</idProducto>
      <nombre>Trek Marlin 5 2024</nombre>
      <cantidad>1</cantidad>
      <precioUnitario>8999.00</precioUnitario>
      <subtotal>8999.00</subtotal>
    </producto>
    <producto>
      <idProducto>17</idProducto>
      <nombre>Casco Bell Nomad 2</nombre>
      <cantidad>2</cantidad>
      <precioUnitario>1250.00</precioUnitario>
      <subtotal>2500.00</subtotal>
    </producto>
  </productos>

</crearVenta>
